{
 "dry_run": false,
 "duration_s": 13.452,
 "fixtures": false,
 "generated_at": "2026-10-11T20:57:49Z",
 "last_run": "2026-10-11T20:57:49Z",
 "python": "3.12.15",
 "run_id": "20261011-205749-56b9bc",
 "schedule": {
  "hours": [
   3,
   10,
   17
  ],
  "minute": 17
 },
 "schema_version": 1,
 "sources": {
  "countries": {
   "changed": false,
   "consumers_year": 2024,
   "eia_error": "skipped: EIA_API_KEY not set",
   "error": null,
   "jodi_month": "2026-07",
   "last_success": "2026-10-11T20:57:49Z",
   "ok": true,
   "partial": [
    "consumers"
   ],
   "producers_year": 2026,
   "stale": false,
   "via": "jodi"
  },
  "crosscheck": {
   "changed": true,
   "claims": 10,
   "error": null,
   "last_success": "2026-10-11T20:57:49Z",
   "mentions": 11,
   "ok": true,
   "stale": false,
   "with_portwatch": 3
  },
  "eia_steo": {
   "changed": false,
   "error": null,
   "last_success": "2026-10-11T20:57:49Z",
   "months": 48,
   "ok": true,
   "quote_found": true,
   "release_date_estimated": false,
   "stale": false,
   "via": "xlsx"
  },
  "fred": {
   "changed": false,
   "error": null,
   "last_success": "2026-10-11T20:57:49Z",
   "ok": true,
   "partial": [],
   "stale": true,
   "via": "fred"
  },
  "news": {
   "candidates": 501,
   "changed": true,
   "dropped": {
    "capped": 383,
    "duplicates": 58,
    "filtered": 98,
    "too_old": 61,
    "unusable": 12
   },
   "error": null,
   "feeds_failed": [],
   "feeds_ok": 20,
   "items": 60,
   "last_success": "2026-10-11T20:57:49Z",
   "ok": true,
   "stale": false
  },
  "proposals": {
   "changed": false,
   "count": 0,
   "error": null,
   "last_success": "2026-10-11T20:57:49Z",
   "model": "",
   "ok": true,
   "provider": "none",
   "reason": "AI disabled (provider none or no API key)",
   "stale": false
  },
  "shipping": {
   "changed": false,
   "error": null,
   "last_success": "2026-10-11T20:57:49Z",
   "latest": "2026-10-04",
   "ok": true,
   "rows": 3210,
   "stale": false,
   "via": "portwatch"
  },
  "summary": {
   "attempts": 0,
   "changed": true,
   "error": null,
   "fallback": true,
   "last_success": "2026-10-11T20:57:49Z",
   "model": "",
   "ok": true,
   "provider": "none",
   "reason": "no_key",
   "stale": false
  }
 }
}
